{
  "axis_names": [
    "x",
    "y",
    "z",
    "w"
  ],
  "dimensions": 4,
  "projection_id": "first-principles-v0-all-spatial-shadow4-v1",
  "schema_version": 1,
  "vectors": [
    {
      "node_id": "fp.adversarial-case",
      "values": [
        -0.115118949,
        0.050429649,
        -0.010631552,
        0.006095396
      ]
    },
    {
      "node_id": "fp.background-condition",
      "values": [
        -0.114622145,
        0.329700515,
        -0.044043112,
        -0.005588448
      ]
    },
    {
      "node_id": "fp.boundary-case",
      "values": [
        -0.127190374,
        0.054497337,
        0.071523418,
        0.004510874
      ]
    },
    {
      "node_id": "fp.composition-order",
      "values": [
        -0.105362512,
        0.309942458,
        -0.105282198,
        0.007030307
      ]
    },
    {
      "node_id": "fp.conservation",
      "values": [
        -0.144513976,
        0.005420278,
        0.194995782,
        0.002989624
      ]
    },
    {
      "node_id": "fp.constraint-conflict",
      "values": [
        -0.053173716,
        -0.472804277,
        -0.380373944,
        -0.003848156
      ]
    },
    {
      "node_id": "fp.control.assumption-fact",
      "values": [
        1.15912221,
        0.165267796,
        0.248845068,
        -0.002003787
      ]
    },
    {
      "node_id": "fp.control.boundary-skip",
      "values": [
        1.159511987,
        0.040845343,
        0.25954991,
        0.002506004
      ]
    },
    {
      "node_id": "fp.control.composition-gap",
      "values": [
        1.17213812,
        0.065046467,
        0.170438588,
        0.003606802
      ]
    },
    {
      "node_id": "fp.control.conflict-ignore",
      "values": [
        1.208171342,
        -0.264777078,
        -0.042218001,
        -0.01266182
      ]
    },
    {
      "node_id": "fp.control.emergence-name",
      "values": [
        1.168498279,
        0.143163678,
        0.186868633,
        0.001228747
      ]
    },
    {
      "node_id": "fp.control.falsifier-immunized",
      "values": [
        1.167450921,
        0.169447095,
        0.191332069,
        0.001721585
      ]
    },
    {
      "node_id": "fp.control.hidden-default",
      "values": [
        1.168027721,
        0.170012759,
        0.187157835,
        -0.004035537
      ]
    },
    {
      "node_id": "fp.control.invariant-example",
      "values": [
        1.123423773,
        -0.026758522,
        0.514161129,
        -0.007226083
      ]
    },
    {
      "node_id": "fp.control.label-primitive",
      "values": [
        1.163975095,
        0.158232189,
        0.21664114,
        -0.003330008
      ]
    },
    {
      "node_id": "fp.control.no-negative",
      "values": [
        1.216683147,
        -0.01971758,
        -0.12671095,
        -3.285e-06
      ]
    },
    {
      "node_id": "fp.control.scale-collapse",
      "values": [
        1.178179909,
        0.189129744,
        0.115997272,
        0.000647849
      ]
    },
    {
      "node_id": "fp.control.soft-hard",
      "values": [
        1.208553474,
        -0.311199587,
        -0.039527016,
        0.002680593
      ]
    },
    {
      "node_id": "fp.counterexample",
      "values": [
        -0.130434095,
        -0.175421977,
        0.118281249,
        0.00254819
      ]
    },
    {
      "node_id": "fp.cross-scale",
      "values": [
        -0.12527414,
        0.283891426,
        0.033867194,
        0.000917669
      ]
    },
    {
      "node_id": "fp.definition",
      "values": [
        -0.095521624,
        0.406263778,
        -0.182882465,
        -0.007270153
      ]
    },
    {
      "node_id": "fp.dependency-question",
      "values": [
        -0.097794287,
        0.14522294,
        -0.139335088,
        0.001769567
      ]
    },
    {
      "node_id": "fp.derived-constraint",
      "values": [
        -0.088589305,
        -0.259048413,
        -0.160241158,
        -0.01256909
      ]
    },
    {
      "node_id": "fp.emergent-property",
      "values": [
        -0.100489409,
        -0.066257038,
        -0.098895363,
        -0.000787716
      ]
    },
    {
      "node_id": "fp.evidence-chain",
      "values": [
        -0.123719528,
        -0.071934523,
        0.06117673,
        0.008311481
      ]
    },
    {
      "node_id": "fp.example.balance",
      "values": [
        -0.109775482,
        0.032417535,
        -0.045807614,
        0.007506204
      ]
    },
    {
      "node_id": "fp.example.counterexample",
      "values": [
        -0.125707411,
        0.067763255,
        0.059930672,
        0.005705854
      ]
    },
    {
      "node_id": "fp.example.hard-soft",
      "values": [
        -0.090377389,
        -0.106812809,
        -0.163647582,
        0.006945559
      ]
    },
    {
      "node_id": "fp.example.pipeline",
      "values": [
        -0.132103816,
        0.036949993,
        0.107164874,
        0.008854416
      ]
    },
    {
      "node_id": "fp.example.queue",
      "values": [
        -0.11328279,
        0.083954855,
        -0.027016524,
        0.008308764
      ]
    },
    {
      "node_id": "fp.example.timeout",
      "values": [
        -0.119356362,
        0.193235753,
        0.003294624,
        0.003977837
      ]
    },
    {
      "node_id": "fp.explicit-assumption",
      "values": [
        -0.10232714,
        0.345917588,
        -0.130110999,
        0.00015801
      ]
    },
    {
      "node_id": "fp.falsifier",
      "values": [
        -0.119680454,
        -0.18863927,
        0.04599993,
        0.008809909
      ]
    },
    {
      "node_id": "fp.hard-constraint",
      "values": [
        -0.084041543,
        -0.628413916,
        -0.151964967,
        -0.006315575
      ]
    },
    {
      "node_id": "fp.hidden-assumption",
      "values": [
        -0.12530831,
        0.087359345,
        0.054739269,
        0.0007174
      ]
    },
    {
      "node_id": "fp.identity-invariant",
      "values": [
        -0.203908306,
        -0.178798817,
        0.622503293,
        0.006955075
      ]
    },
    {
      "node_id": "fp.interface-constraint",
      "values": [
        -0.065431256,
        -0.529183374,
        -0.29038187,
        0.000942657
      ]
    },
    {
      "node_id": "fp.invariant",
      "values": [
        -0.203359178,
        -0.109185272,
        0.610934141,
        -0.015919032
      ]
    },
    {
      "node_id": "fp.irreducibility",
      "values": [
        -0.08824181,
        0.295084125,
        -0.221469142,
        -0.010791911
      ]
    },
    {
      "node_id": "fp.mechanism-chain",
      "values": [
        -0.11388893,
        -0.08597126,
        -0.005252396,
        -0.002179957
      ]
    },
    {
      "node_id": "fp.model-assumption",
      "values": [
        -0.114201613,
        0.18113775,
        -0.03108829,
        -0.006851181
      ]
    },
    {
      "node_id": "fp.negative-control",
      "values": [
        -0.060049587,
        0.116700692,
        -0.395789677,
        0.005883983
      ]
    },
    {
      "node_id": "fp.observation",
      "values": [
        -0.08358835,
        0.364872254,
        -0.260862765,
        0.005432283
      ]
    },
    {
      "node_id": "fp.operation",
      "values": [
        -0.117705839,
        0.398233907,
        -0.030311614,
        -0.011606638
      ]
    },
    {
      "node_id": "fp.order-invariant",
      "values": [
        -0.171535143,
        -0.253707955,
        0.407861035,
        -0.004218966
      ]
    },
    {
      "node_id": "fp.problem-boundary",
      "values": [
        -0.090560104,
        -0.150161952,
        -0.158445112,
        0.002842031
      ]
    },
    {
      "node_id": "fp.relation",
      "values": [
        -0.085484657,
        0.374392398,
        -0.248678344,
        0.004161453
      ]
    },
    {
      "node_id": "fp.representation-invariant",
      "values": [
        -0.17975948,
        0.015068589,
        0.436669077,
        0.003508967
      ]
    },
    {
      "node_id": "fp.resource-constraint",
      "values": [
        -0.072550696,
        -0.593075617,
        -0.234771047,
        0.000406944
      ]
    },
    {
      "node_id": "fp.root",
      "values": [
        -0.110221914,
        0.010521644,
        -0.040148781,
        0.009433944
      ]
    },
    {
      "node_id": "fp.safety-invariant",
      "values": [
        -0.203401106,
        -0.124195802,
        0.61359834,
        0.002154792
      ]
    },
    {
      "node_id": "fp.scope-failure",
      "values": [
        -0.091718916,
        0.157247572,
        -0.182697974,
        -0.004576573
      ]
    },
    {
      "node_id": "fp.soft-constraint",
      "values": [
        -0.055558059,
        -0.545161645,
        -0.35622298,
        -0.00485147
      ]
    },
    {
      "node_id": "fp.state-transition",
      "values": [
        -0.200340803,
        0.025472181,
        0.576676227,
        0.003057111
      ]
    }
  ]
}
